{
  "contract_version": "1.0.0",
  "execution_mode": "strict_enforcement",
  "response_type": "page_remediation_report",
  "application": {
    "application_name": "Quote Connect 360",
    "environment": "development",
    "review_scope": "single_page_forensic_review"
  },
  "page_review": {
    "page_name": "Dashboard",
    "page_route": "/",
    "review_sequence": 1,
    "review_status": "partial",
    "dependency_map": {
      "ui_layer": ["src/pages/Dashboard.jsx", "src/components/dashboard/DashboardMetricGrid.jsx", "src/components/layout/AppLayout.jsx"],
      "api_services": ["base44.entities.BenefitCase.list", "base44.entities.CaseTask.list", "domain/dashboard/useDashboardMetrics.js"],
      "data_layer": ["BenefitCase entity", "CaseTask entity", "QuoteScenario entity"],
      "auth_access": ["AuthProvider", "useAuth", "AdminRoute"],
      "workflow_logic": ["dashboard metrics aggregation", "role-scoped filtering", "drill-down routing"],
      "infrastructure": ["React Router", "TanStack Query", "Base44 SDK"]
    },
    "failure_point_inventory": [
      { "failure_id": "FP-001", "layer": "ui", "failure_point": "Dashboard can crash during initial metric render.", "reviewed": true, "evidence": "Metric cards depend on async data and require guarded render paths." },
      { "failure_id": "FP-002", "layer": "api", "failure_point": "Dashboard queries can return incomplete payloads.", "reviewed": true, "evidence": "Aggregated dashboard state depends on multiple entity reads with differing completeness." },
      { "failure_id": "FP-003", "layer": "data", "failure_point": "Case metrics can misalign with entity defaults.", "reviewed": true, "evidence": "Missing status defaults can cause incorrect KPI grouping and totals." },
      { "failure_id": "FP-004", "layer": "auth", "failure_point": "Role scope can hide data unexpectedly.", "reviewed": true, "evidence": "Admin and non-admin flows use different entity query strategies and must stay aligned." },
      { "failure_id": "FP-005", "layer": "workflow", "failure_point": "Stage summaries can diverge from actual lifecycle rules.", "reviewed": true, "evidence": "Dashboard cards summarize stages that depend on cross-page workflow consistency." },
      { "failure_id": "FP-006", "layer": "infrastructure", "failure_point": "Runtime dependency failures can block page hydration.", "reviewed": true, "evidence": "Router, query provider, and auth wrapper must all initialize before dashboard content renders." },
      { "failure_id": "FP-007", "layer": "ui", "failure_point": "Broken drill-down links can route users incorrectly.", "reviewed": true, "evidence": "Dashboard action surfaces depend on exact route contracts for downstream pages." },
      { "failure_id": "FP-008", "layer": "workflow", "failure_point": "Task and case summaries can drift from persisted activity state.", "reviewed": true, "evidence": "Dashboard relies on last-activity and task state being updated consistently across pages." }
    ],
    "issues": [
      {
        "issue_id": "ISSUE-001",
        "title": "Initial dashboard metric render instability",
        "severity": "critical",
        "layer": "ui",
        "symptom": "Dashboard can fail before fully rendering cards when dependent values are missing during first paint.",
        "root_cause": "Dashboard metric components relied on asynchronous entity-derived values without complete defensive fallbacks for early render and partial dataset states.",
        "location": ["src/pages/Dashboard.jsx", "src/components/dashboard/DashboardMetricGrid.jsx"],
        "failure_mechanism": "The render path attempted to derive display values before all query-backed aggregates were normalized into safe defaults.",
        "impact": "Users can experience a blank or unstable dashboard route instead of a resilient loading-to-data transition.",
        "fix_implemented": "Normalized dashboard render dependencies so card sections receive guarded values and remain stable across loading, empty, and partial data states.",
        "files_changed": ["src/pages/Dashboard.jsx", "src/components/dashboard/DashboardMetricGrid.jsx"],
        "why_fix_is_correct": "It removes unsafe render assumptions and enforces a deterministic contract between async query state and card presentation.",
        "enterprise_alignment": ["defensive_programming", "proper_error_handling", "maintainability", "regression_safe"],
        "validation_evidence": ["Verified dashboard route remains renderable with async loading and incomplete metric inputs."],
        "status": "fixed"
      },
      {
        "issue_id": "ISSUE-002",
        "title": "Dashboard drill-down dependency mismatch",
        "severity": "high",
        "layer": "workflow",
        "symptom": "Dashboard links and summary cards can direct users into mismatched filtered views.",
        "root_cause": "The dashboard depended on downstream route context assumptions that were not consistently aligned with the cases page filter contract.",
        "location": ["src/pages/Dashboard.jsx", "src/lib/routing/resolveRouteContext.js", "src/pages/Cases.jsx"],
        "failure_mechanism": "Summary cards emitted drill-down intents that could diverge from the filters actually consumed by the destination page model.",
        "impact": "Users can land on downstream pages that appear inconsistent with the dashboard metric they selected.",
        "fix_implemented": "Aligned dashboard drill-down logic with the route resolver and downstream page filter contract so summary navigation reflects real filtered state.",
        "files_changed": ["src/pages/Dashboard.jsx", "src/lib/routing/resolveRouteContext.js", "src/pages/Cases.jsx"],
        "why_fix_is_correct": "It ensures the source metric definition and destination page interpretation use the same contract and no longer drift.",
        "enterprise_alignment": ["clean_architecture", "schema_alignment", "no_duplicate_logic", "regression_safe"],
        "validation_evidence": ["Verified dashboard metric navigation resolves into matching downstream filtered page states."],
        "status": "fixed"
      },
      {
        "issue_id": "ISSUE-003",
        "title": "Dashboard activity totals can go stale after case updates",
        "severity": "medium",
        "layer": "data",
        "symptom": "Dashboard cards may display outdated counts after case-detail edits or workflow actions.",
        "root_cause": "Upstream pages did not consistently refresh or stamp last-activity and related query keys after persisted case mutations.",
        "location": ["src/pages/CaseDetail.jsx", "src/components/cases/CaseEditModal.jsx", "src/components/cases/CaseCloseModal.jsx"],
        "failure_mechanism": "Dashboard aggregate queries depend on current persisted case activity fields, but upstream mutation paths were not fully audit-refresh safe.",
        "impact": "Users can see stale dashboard numbers that do not match the latest case state.",
        "fix_implemented": "Hardened case update and close flows to refresh activity-linked queries and persist current activity timestamps needed by dashboard summaries.",
        "files_changed": ["src/pages/CaseDetail.jsx", "src/components/cases/CaseEditModal.jsx", "src/components/cases/CaseCloseModal.jsx"],
        "why_fix_is_correct": "It brings upstream persistence and downstream aggregation into a single consistent data freshness model.",
        "enterprise_alignment": ["explicit_validation", "schema_alignment", "maintainability", "regression_safe"],
        "validation_evidence": ["Verified dashboard-dependent activity fields are refreshed after case mutations that affect summary state."],
        "status": "fixed"
      }
    ],
    "validation": {
      "ui_validation": {
        "reviewed": true,
        "passed": true,
        "checks": [
          "Dashboard route renders without blank-screen failure during loading state transitions.",
          "Dashboard cards remain visible and stable with empty and populated data scenarios."
        ]
      },
      "functional_validation": {
        "reviewed": true,
        "passed": true,
        "checks": [
          "Dashboard summary interactions route users into downstream views consistently.",
          "Dashboard card state remains aligned after upstream case updates."
        ]
      },
      "api_validation": {
        "reviewed": true,
        "passed": true,
        "checks": [
          "Dashboard entity-backed reads remain aligned with the data consumed by card aggregations.",
          "No active request contract mismatch remains in the reviewed dashboard data paths."
        ]
      },
      "data_validation": {
        "reviewed": true,
        "passed": true,
        "checks": [
          "Dashboard summaries tolerate empty datasets without invalid totals or null crashes.",
          "Case activity-dependent counts now refresh after reviewed upstream mutations."
        ]
      },
      "auth_validation": {
        "reviewed": true,
        "passed": true,
        "checks": [
          "Role-scoped dashboard reads remain consistent with app auth wrappers.",
          "Reviewed dashboard paths do not expose unauthorized data outside expected role scope."
        ]
      },
      "error_handling_validation": {
        "reviewed": true,
        "passed": true,
        "checks": [
          "Reviewed dashboard render paths handle incomplete data without fatal exceptions.",
          "Dashboard fallback behavior remains present when source data is missing or empty."
        ]
      }
    },
    "console_and_server_cleanliness": {
      "console_errors_present": false,
      "network_errors_present": false,
      "server_exceptions_present": false,
      "silent_failures_present": false,
      "details": "No active errors remain; reviewed dashboard and linked case-detail mutation paths are currently clean."
    },
    "downstream_impact_analysis": {
      "linked_pages_reviewed": ["/cases", "/cases/:id"],